{
  "schema": "mnstry.atelier-upgrade-plan@v2",
  "digest": "sha256:aaaaaaaaaaaaaaaaaaaaaaaaaaaaaaaaaaaaaaaaaaaaaaaaaaaaaaaaaaaaaaaa",
  "operation": "prepare-local-candidate",
  "workspace": "/example/workspace",
  "repositoryId": "sha256:aaaaaaaaaaaaaaaaaaaaaaaaaaaaaaaaaaaaaaaaaaaaaaaaaaaaaaaaaaaaaaaa",
  "configPath": "atelier.project.json",
  "baseHead": "aaaaaaaaaaaaaaaaaaaaaaaaaaaaaaaaaaaaaaaa",
  "baseTree": "aaaaaaaaaaaaaaaaaaaaaaaaaaaaaaaaaaaaaaaa",
  "branch": "refs/heads/example-upgrade",
  "createdAt": "2026-01-01T00:00:00Z",
  "expiresAt": "2026-01-02T00:00:00Z",
  "policy": {
    "schema": "mnstry.atelier-adoption-policy@v1",
    "enabled": true,
    "mode": "manual-exact-plan",
    "maxAgeSeconds": 86400,
    "recoveryCoverage": "local-only",
    "allowedEffects": [
      "lock-and-projections",
      "git-commit"
    ]
  },
  "policyDigest": "sha256:aaaaaaaaaaaaaaaaaaaaaaaaaaaaaaaaaaaaaaaaaaaaaaaaaaaaaaaaaaaaaaaa",
  "executorDigest": "sha256:aaaaaaaaaaaaaaaaaaaaaaaaaaaaaaaaaaaaaaaaaaaaaaaaaaaaaaaaaaaaaaaa",
  "gitDigest": "sha256:aaaaaaaaaaaaaaaaaaaaaaaaaaaaaaaaaaaaaaaaaaaaaaaaaaaaaaaaaaaaaaaa",
  "gitConfigDigest": "sha256:aaaaaaaaaaaaaaaaaaaaaaaaaaaaaaaaaaaaaaaaaaaaaaaaaaaaaaaaaaaaaaaa",
  "hooksDigest": "sha256:aaaaaaaaaaaaaaaaaaaaaaaaaaaaaaaaaaaaaaaaaaaaaaaaaaaaaaaaaaaaaaaa",
  "hooksPath": "/example/git/hooks",
  "readSet": [],
  "migration": {
    "schema": "mnstry.atelier-migration@v2",
    "id": "local-lock-projections@1",
    "executorDigest": "sha256:aaaaaaaaaaaaaaaaaaaaaaaaaaaaaaaaaaaaaaaaaaaaaaaaaaaaaaaaaaaaaaaa",
    "readScope": "whole-enrolled-repository",
    "allowedWrites": [
      "atelier.lock.json"
    ],
    "sideEffects": [
      "git-index",
      "git-commit"
    ],
    "postChecks": [
      "exact-inventory",
      "lock-schema",
      "exact-index",
      "commit-parent-tree-message"
    ]
  },
  "writes": [],
  "releaseEvidence": null,
  "dependencyInstallation": "excluded",
  "mode": "manual-exact-plan",
  "recoveryCoverage": "local-only",
  "message": "Prepare Atelier local lock and projections",
  "gitAuxDigest": "sha256:aaaaaaaaaaaaaaaaaaaaaaaaaaaaaaaaaaaaaaaaaaaaaaaaaaaaaaaaaaaaaaaa"
}
